{
  "schema": "bakingrl.marketplace-package/1",
  "id": "com.bakingrl.player-streak",
  "developerId": "quillianne",
  "repo": "https://github.com/Quillianne/BakingRLPlugins",
  "listingUrl": "https://raw.githubusercontent.com/Quillianne/BakingRLPlugins/plugins-v1.0.4/player-streak/marketplace/listing.json",
  "approvedVersions": [
    {
      "version": "1.0.4",
      "bundleUrl": "https://github.com/Quillianne/BakingRLPlugins/releases/download/plugins-v1.0.4/com.bakingrl.player-streak-1.0.4.brlp",
      "bundleSha256": "467b336b98053972764818548a67cf2ca56c32a443877a531b78c890a57f60bb",
      "signaturePublicKey": "3ZK2t4SPZKufX40dwRPSDP+y2B2+L2Pq3PQ+4HJJ+3w=",
      "runtimeApi": "1.0.0",
      "review": {
        "status": "approved",
        "reviewedAt": "2026-06-16T10:38:39Z",
        "permissions": {
          "bus": {
            "read": [
              "MatchCreated",
              "MatchInitialized",
              "MatchEnded",
              "MatchDestroyed",
              "plugin.com.bakingrl.cast-package.sequence",
              "plugin.com.bakingrl.cast-package.player-stats",
              "plugin.com.bakingrl.player-streak.state"
            ],
            "publish": [
              "plugin.com.bakingrl.player-streak.*"
            ]
          },
          "registry": {
            "read": [
              "plugin.com.bakingrl.cast-package.sequence",
              "plugin.com.bakingrl.cast-package.player-stats",
              "plugin.com.bakingrl.player-streak.*"
            ],
            "write": [
              "plugin.com.bakingrl.player-streak.*"
            ]
          },
          "network": {
            "http": [],
            "websocket": []
          },
          "storage": {
            "read": [
              "plugin://self/*"
            ],
            "write": [
              "plugin://self/*"
            ]
          }
        }
      }
    }
  ]
}
