{
  "schema": "bakingrl.marketplace-package/1",
  "id": "com.bakingrl.cast-package",
  "developerId": "quillianne",
  "repo": "https://github.com/Quillianne/BakingRLPlugins",
  "listingUrl": "https://raw.githubusercontent.com/Quillianne/BakingRLPlugins/plugins-v1.0.0/cast-package/marketplace/listing.json",
  "approvedVersions": [
    {
      "version": "1.0.0",
      "bundleUrl": "https://github.com/Quillianne/BakingRLPlugins/releases/download/plugins-v1.0.0/com.bakingrl.cast-package-1.0.0.brlp",
      "bundleSha256": "3ddb3cec62a605c15da80f8cf8cbc4c4aac95206fda4f1e9353f4d6b2a2bc9c6",
      "signaturePublicKey": "3ZK2t4SPZKufX40dwRPSDP+y2B2+L2Pq3PQ+4HJJ+3w=",
      "runtimeApi": "0.4.0",
      "review": {
        "status": "approved",
        "reviewedAt": "2026-05-12T16:41:21.962Z",
        "permissions": {
          "bus": {
            "read": [
              "UpdateState",
              "ClockUpdatedSeconds",
              "CountdownBegin",
              "GoalScored",
              "MatchCreated",
              "MatchInitialized",
              "MatchEnded",
              "RoundStarted",
              "StatfeedEvent",
              "plugin.com.bakingrl.cast-package.state"
            ],
            "publish": [
              "plugin.com.bakingrl.cast-package.*"
            ]
          },
          "registry": {
            "read": [
              "plugin.com.bakingrl.cast-package.state"
            ],
            "write": [
              "plugin.com.bakingrl.cast-package.*"
            ]
          },
          "network": {
            "http": [],
            "websocket": []
          },
          "storage": {
            "read": [
              "plugin://self/*"
            ],
            "write": [
              "plugin://self/*"
            ]
          }
        }
      }
    }
  ]
}
